{
  "id": "gold-153",
  "question": "只看客户等级 3 的客户，按分支统计 2014 年佣金收入，列出前 5 名",
  "expected_metric": "commission_revenue",
  "expected_dimensions": [
    "Branch"
  ],
  "expected_time": "2014",
  "expected_sql": "SELECT db.Branch AS branch, SUM(ft.Commission) AS commission_revenue FROM atlas.dwd.fact_trades ft JOIN atlas.dwd.dim_date dd ON ft.SK_CreateDateID = dd.SK_DateID JOIN atlas.dwd.dim_customer dc ON ft.SK_CustomerID = dc.SK_CustomerID JOIN atlas.dwd.dim_broker db ON ft.SK_BrokerID = db.SK_BrokerID WHERE dd.CalendarYearID = 2014 AND dc.Tier = 3 GROUP BY db.Branch ORDER BY commission_revenue DESC LIMIT 5",
  "expected_filters": [
    {
      "column": "Tier",
      "op": "=",
      "value": 3
    }
  ],
  "result_hash": "148908772c6513deaba70c0b0fdc1f9b192747b3b665d591e91b81136962047a",
  "snapshot_sha": "b7e9ce7",
  "tags": [
    "aggregation",
    "dimension_group_by",
    "filter",
    "equality_filter",
    "ranking",
    "time_range",
    "fibo_alignment"
  ],
  "ambiguous": false,
  "fibo_concepts": [
    {
      "term": "佣金收入",
      "concept": "https://spec.edmcouncil.org/fibo/ontology/FBC/ProductsAndServices/ClientsAndAccounts/Fee",
      "role": "measure",
      "note": "佣金是经纪服务收取的费用"
    },
    {
      "term": "客户等级",
      "concept": "https://spec.edmcouncil.org/fibo/ontology/FND/AgentsAndPeople/People/Person",
      "role": "dimension",
      "note": "等值过滤载体：等级 3 客户（Tier = 3）"
    },
    {
      "term": "分支",
      "concept": "https://www.omg.org/spec/Commons/Organizations/OrganizationalSubUnit",
      "role": "dimension",
      "note": "营业部/分支是组织的子单元（OMG Commons）"
    }
  ]
}
