{
  "id": "gold-133",
  "question": "2013 年 1 月 7 日交易笔数是多少？",
  "expected_metric": "trade_count",
  "expected_dimensions": [],
  "expected_time": "2013-01-07",
  "expected_sql": "SELECT COUNT(ft.TradeID) AS trade_count FROM atlas.dwd.fact_trades ft JOIN atlas.dwd.dim_date dd ON ft.SK_CreateDateID = dd.SK_DateID WHERE dd.DateValue = DATE '2013-01-07' LIMIT 100",
  "result_hash": "85daaf6f7055cd5736287faed9603d712920092c4f8fd0097ec3b650bf27530e",
  "snapshot_sha": "b47a6c1",
  "tags": [
    "aggregation",
    "time_range",
    "fibo_alignment"
  ],
  "ambiguous": false,
  "fibo_concepts": [
    {
      "term": "交易",
      "concept": "https://spec.edmcouncil.org/fibo/ontology/FBC/FinancialInstruments/FinancialInstruments/SecuritiesTransaction",
      "role": "event",
      "note": "交易笔数是对证券交易事件的计数"
    },
    {
      "term": "2013 年 1 月 7 日",
      "concept": "https://www.omg.org/spec/Commons/DatesAndTimes/Date",
      "role": "time",
      "note": "单日粒度"
    }
  ]
}
