{
  "id": "gold-062",
  "question": "2000 年 5 月的销售额是多少？",
  "expected_metric": "total_sales_price",
  "expected_dimensions": [],
  "expected_time": "200005",
  "expected_filters": null,
  "expected_sql": "SELECT SUM(store_sales.ss_ext_sales_price) AS total_sales_price FROM atlas.dwd.store_sales AS store_sales INNER JOIN atlas.dwd.date_dim AS dim_date ON store_sales.ss_sold_date_sk = dim_date.d_date_sk WHERE dim_date.d_year = 2000 AND dim_date.d_moy = 5 LIMIT 100",
  "result_hash": "45e100251b8190f53678cfaac55eae9475ffb62178d15d9af6549393d4e7b0a0",
  "snapshot_sha": "92033c9",
  "tags": [
    "aggregation",
    "time_range"
  ],
  "ambiguous": false
}
