{
  "id": "gold-053",
  "question": "2000 年净利润是多少？",
  "expected_metric": "net_profit",
  "expected_dimensions": [],
  "expected_time": "2000",
  "expected_filters": null,
  "expected_sql": "SELECT SUM(store_sales.ss_net_profit) AS net_profit FROM atlas.dwd.store_sales AS store_sales INNER JOIN atlas.dwd.date_dim AS dim_date ON store_sales.ss_sold_date_sk = dim_date.d_date_sk WHERE dim_date.d_year = 2000 LIMIT 100",
  "result_hash": "<待执行后填写>",
  "snapshot_sha": "<待锁定后填写>",
  "tags": [
    "aggregation",
    "time_range"
  ],
  "ambiguous": false
}
