{
  "id": "gold-170",
  "question": "List the top 5 branches by commission revenue over 10 million in 2013",
  "expected_metric": "commission_revenue",
  "expected_dimensions": [
    "Branch"
  ],
  "expected_time": "2013",
  "expected_filters": [
    {
      "column": "commission_revenue",
      "op": ">",
      "value": 10000000
    }
  ],
  "expected_sql": "SELECT dim_broker.Branch AS Branch, SUM(fact_trades.Commission) AS commission_revenue FROM atlas.dwd.fact_trades AS fact_trades INNER JOIN atlas.dwd.dim_date AS dim_date ON fact_trades.SK_CreateDateID = dim_date.SK_DateID INNER JOIN atlas.dwd.dim_broker AS dim_broker ON fact_trades.SK_BrokerID = dim_broker.SK_BrokerID WHERE dim_date.CalendarYearID = 2013 GROUP BY dim_broker.Branch HAVING SUM(fact_trades.Commission) > 10000000 ORDER BY commission_revenue DESC LIMIT 5",
  "result_hash": "e3b0c44298fc1c149afbf4c8996fb92427ae41e4649b934ca495991b7852b855",
  "snapshot_sha": "1e5d35b",
  "tags": [
    "aggregation",
    "dimension_group_by",
    "filter",
    "metric_threshold",
    "ranking",
    "time_range",
    "fibo_alignment",
    "lang_en"
  ],
  "ambiguous": false,
  "fibo_concepts": [
    {
      "term": "commission revenue",
      "concept": "https://spec.edmcouncil.org/fibo/ontology/FBC/ProductsAndServices/ClientsAndAccounts/Fee",
      "role": "measure",
      "note": "Carrier of the metric threshold (HAVING semantics)"
    },
    {
      "term": "branch",
      "concept": "https://www.omg.org/spec/Commons/Organizations/OrganizationalSubUnit",
      "role": "dimension",
      "note": "Branches/offices are organizational sub-units (OMG Commons)"
    }
  ]
}
