{
  "id": "gold-172",
  "question": "2015 年交易额同比",
  "expected_metric": "total_trade_value",
  "expected_dimensions": [],
  "expected_time": "2015",
  "expected_comparison": {
    "kind": "yoy"
  },
  "expected_sql": null,
  "result_hash": "4c14f4eb371c9f30841cda711a968261b38240f4288f06e2b69d63cb8f64a2e7",
  "snapshot_sha": "ccb4c8b",
  "tags": [
    "aggregation",
    "time_range",
    "comparison",
    "yoy"
  ],
  "ambiguous": false,
  "fibo_concepts": [
    {
      "term": "交易额",
      "concept": "https://spec.edmcouncil.org/fibo/ontology/FND/Accounting/CurrencyAmount/MonetaryAmount",
      "role": "measure",
      "note": "交易额以货币金额度量"
    },
    {
      "term": "同比",
      "concept": "https://spec.edmcouncil.org/fibo/ontology/FND/Accounting/CurrencyAmount/MonetaryAmount",
      "role": "measure",
      "note": "同比 = 与上一年同期比较"
    }
  ]
}
