{
  "id": "gold-136",
  "question": "2016 年 6 月 30 日持仓账户数是多少？",
  "expected_metric": "holding_account_count",
  "expected_dimensions": [],
  "expected_time": "2016-06-30",
  "expected_sql": "SELECT COUNT(DISTINCT fh.SK_AccountID) AS holding_account_count FROM atlas.dwd.fact_holdings fh JOIN atlas.dwd.dim_date dd ON fh.SK_DateID = dd.SK_DateID WHERE dd.DateValue = DATE '2016-06-30' LIMIT 100",
  "result_hash": "3038bfb575bee6a0e61945eff8784835bb2c720634e42734678c083994b7f018",
  "snapshot_sha": "b47a6c1",
  "tags": [
    "aggregation",
    "as_of_snapshot",
    "time_range",
    "fibo_alignment"
  ],
  "ambiguous": false,
  "fibo_concepts": [
    {
      "term": "账户",
      "concept": "https://spec.edmcouncil.org/fibo/ontology/FBC/ProductsAndServices/ClientsAndAccounts/BrokerageAccount",
      "role": "entity",
      "note": "持仓账户 = 快照日持有证券的经纪账户"
    },
    {
      "term": "2016 年 6 月 30 日",
      "concept": "https://www.omg.org/spec/Commons/DatesAndTimes/Date",
      "role": "time",
      "note": "持仓快照日"
    }
  ]
}
