{
  "id": "gold-051",
  "question": "2000 年总销售额是多少？",
  "expected_metric": "total_sales_price",
  "expected_dimensions": [],
  "expected_time": "2000",
  "expected_filters": null,
  "expected_sql": "SELECT SUM(store_sales.ss_ext_sales_price) AS total_sales_price FROM atlas.dwd.store_sales AS store_sales INNER JOIN atlas.dwd.date_dim AS dim_date ON store_sales.ss_sold_date_sk = dim_date.d_date_sk WHERE dim_date.d_year = 2000 LIMIT 100",
  "result_hash": "38008268343ec2d3b099c3de3b4e6898806b935955718e95bb007a85db170cf5",
  "snapshot_sha": "92033c9",
  "tags": [
    "aggregation",
    "time_range"
  ],
  "ambiguous": false
}
