{
  "id": "gold-159",
  "question": "2013 年佣金率是多少？",
  "expected_metric": "commission_rate",
  "expected_dimensions": [],
  "expected_time": "2013",
  "expected_sql": "SELECT SUM(fact_trades.Commission) / SUM(fact_trades.Quantity * fact_trades.TradePrice) AS commission_rate FROM atlas.dwd.fact_trades AS fact_trades INNER JOIN atlas.dwd.dim_date AS dim_date ON fact_trades.SK_CreateDateID = dim_date.SK_DateID WHERE dim_date.CalendarYearID = 2013 LIMIT 100",
  "result_hash": "fd1085eab41e64db16edf1a40cecc015ee8d0399000203b2450d98c31539790d",
  "snapshot_sha": "30b8344",
  "tags": [
    "aggregation",
    "time_range",
    "fibo_alignment"
  ],
  "ambiguous": false,
  "fibo_concepts": [
    {
      "term": "佣金率",
      "concept": "https://spec.edmcouncil.org/fibo/ontology/FBC/ProductsAndServices/ClientsAndAccounts/Fee",
      "role": "measure",
      "note": "佣金率 = 佣金合计 / 成交金额，无单位比率（口径以 YAML 表达式为准，派生指标锚定）"
    }
  ]
}
