{
  "id": "gold-061",
  "question": "1999 年第一季度销售额是多少？",
  "expected_metric": "total_sales_price",
  "expected_dimensions": [],
  "expected_time": "1999Q1",
  "expected_filters": null,
  "expected_sql": "SELECT SUM(store_sales.ss_ext_sales_price) AS total_sales_price FROM atlas.dwd.store_sales AS store_sales INNER JOIN atlas.dwd.date_dim AS dim_date ON store_sales.ss_sold_date_sk = dim_date.d_date_sk WHERE dim_date.d_year = 1999 AND dim_date.d_qoy = 1 LIMIT 100",
  "result_hash": "4f872ef5959837a94ce8f6b923e0b86503b9176c2190d296a6b78f5172a045ac",
  "snapshot_sha": "92033c9",
  "tags": [
    "aggregation",
    "time_range"
  ],
  "ambiguous": false
}
