{
  "id": "gold-168",
  "question": "Show commission revenue by branch in 2013 and list the top 5 branches",
  "expected_metric": "commission_revenue",
  "expected_dimensions": [
    "Branch"
  ],
  "expected_time": "2013",
  "expected_filters": null,
  "expected_sql": "SELECT dim_broker.Branch AS Branch, SUM(fact_trades.Commission) AS commission_revenue FROM atlas.dwd.fact_trades AS fact_trades INNER JOIN atlas.dwd.dim_date AS dim_date ON fact_trades.SK_CreateDateID = dim_date.SK_DateID INNER JOIN atlas.dwd.dim_broker AS dim_broker ON fact_trades.SK_BrokerID = dim_broker.SK_BrokerID WHERE dim_date.CalendarYearID = 2013 GROUP BY dim_broker.Branch ORDER BY commission_revenue DESC LIMIT 5",
  "result_hash": "557479f4a0f21051949ddb1725fd3eb440b97361f4b2f20c8e7f49072ebc53ce",
  "snapshot_sha": "1e5d35b",
  "tags": [
    "aggregation",
    "dimension_group_by",
    "ranking",
    "time_range",
    "fibo_alignment",
    "lang_en"
  ],
  "ambiguous": false,
  "fibo_concepts": [
    {
      "term": "commission revenue",
      "concept": "https://spec.edmcouncil.org/fibo/ontology/FBC/ProductsAndServices/ClientsAndAccounts/Fee",
      "role": "measure",
      "note": "Commission is the fee charged for brokerage services"
    },
    {
      "term": "branch",
      "concept": "https://www.omg.org/spec/Commons/Organizations/OrganizationalSubUnit",
      "role": "dimension",
      "note": "Branches/offices are organizational sub-units (OMG Commons)"
    }
  ]
}
